{
	"$schema": "http://json-schema.org/draft-07/schema#",
	"type": "array",
	"items": {
		"type": "object",
		"properties": {
			"shortName": {
				"type": "string"
			},
			"name": {
				"type": "string"
			},
			"start": {
              "oneOf": [{
				"type": "string",
				"format": "date"
              },
              {
				"type": "string",
      			"pattern": "^[0-9]{4}$"
              }]
			},
			"end": {
              "oneOf": [{
				"type": "string",
				"format": "date"
              },
              {
				"type": "string",
      			"pattern": "^[0-9]{4}$"
              }]
			},
			"deadline": {
				"oneOf": [{
						"type": "string",
						"maxLength": 0
					},
					{
						"type": "string",
						"format": "date"
					}
				]
			},
			"city": {
				"type": "string"
			},
			"country": {
				"type": "string"
			},
			"link": {
				"oneOf": [{
						"type": "string",
						"maxLength": 0
					},
					{
						"type": "string",
						"format": "uri"
					}
				]
			},
			"addressLink": {
				"oneOf": [{
						"type": "string",
						"maxLength": 0
					},
					{
						"type": "string",
						"format": "uri"
					}
				]
			},
			"type": {
				"oneOf": [{
						"type": "string",
						"maxLength": 0
					},
					{
						"enum": ["Conference", "Workshop", "School"]
					}
				]
			},
			"note": {
				"type": "string"
			},
			"cost": {
				"type": "string",
                "maxLength": 20
			},
			"costNote": {
				"type": "string",
                "maxLength": 100
            }
		},
		"additionalProperties": false,
		"required": ["shortName", "name", "start", "end", "city", "country", "type"]
	}
}
