[
  {
    "shortName": "ICRA",
    "name": "IEEE International Conference on Robotics and Automation",
    "start": "2027",
    "end": "2027",
    "deadline": "",
    "city": "Seoul",
    "country": "South Korea",
    "link": "",
    "type": "Conference",
    "addressLink": "",
    "note": ""
  }
]
