[
  {
    "shortName": "SII",
    "name": "IEEE/SICE International Symposium on System Integration",
    "start": "2026-01-11",
    "end": "2026-01-14",
    "deadline": "2025-08-01",
    "city": "Cancun",
    "country": "Mexico",
    "link": "https://sice-si.org/SII2026/",
    "type": "Conference",
    "addressLink": "https://maps.app.goo.gl/JmuB7wzPvWgmtm6R8",
    "note": "IEEE/SICE SII is the premier symposium series presenting the state-of-the-art and future perspectives of system integration, where academic researchers and industry experts share ideas and experiences surrounding frontier technologies, research breakthroughs, and innovative solutions and applications."
  },
  {
    "shortName": "ERF",
    "name": "European Robotics Forum",
    "start": "2026-03-23",
    "end": "2026-03-26",
    "deadline": "",
    "city": "Stavanger",
    "country": "Norway",
    "link": "",
    "type": "Conference",
    "addressLink": "",
    "note": ""
  },
  {
    "shortName": "ICRA",
    "name": "IEEE International Conference on Robotics and Automation",
    "start": "2026-06-01",
    "end": "2026-06-05",
    "deadline": "",
    "city": "Wien",
    "country": "Austria",
    "link": "",
    "type": "Conference",
    "addressLink": "",
    "note": ""
  },
  {
    "shortName": "AIM",
    "name": "IEEE/ASME International Conference on Advanced Intelligent Mechatronics",
    "start": "2026-07-07",
    "end": "2026-07-11",
    "deadline": "",
    "city": "Genova",
    "country": "Italy",
    "link": "",
    "type": "Conference",
    "addressLink": "",
    "note": ""
  },
  {
    "shortName": "AUV",
    "name": "IEEE OES AUV",
    "start": "2026-09-01",
    "end": "2026-09-03",
    "deadline": "",
    "city": "Southampton",
    "country": "UK",
    "link": "",
    "type": "Conference",
    "addressLink": "",
    "note": ""
  },
  {
    "shortName": "EHAPTICS",
    "name": "Eurohaptics",
    "start": "2026",
    "end": "2026",
    "deadline": "",
    "city": "Siena",
    "country": "Italy",
    "link": "https://eurohaptics.org/ehc2026/",
    "type": "Conference",
    "addressLink": "https://g.co/kgs/UqiUpmV",
    "note": ""
  },
  {
    "shortName": "IROS",
    "name": "IEEE/RSJ International Conference on Intelligent Robots and Systems",
    "start": "2026",
    "end": "2026",
    "deadline": "",
    "city": "TBD",
    "country": "USA",
    "link": "",
    "type": "Conference",
    "addressLink": "",
    "note": ""
  },
  {
    "shortName": "BioRob",
    "name": "11th IEEE RAS/EMBS International Conference on Biomedical Robotics and Biomechatronics",
    "start": "2026-08-01",
    "end": "2026-08-04",
    "deadline": "",
    "city": "Edmonton",
    "country": "Canada",
    "link": "",
    "type": "Conference",
    "addressLink": "",
    "note": ""
  }
]