[
  {
    "name": "Summer School Deformations in Robotics",
    "deadline": "",
    "city": "Villeneuve d’Ascq (Lille)",
    "country": "France",
    "link": "https://defrobotics2022.sciencesconf.org/",
    "type": "School",
    "shortName": "DEF",
    "start": "2022-07-04",
    "end": "2022-07-08",
    "addressLink": "",
    "note": ""
  },
  {
    "name": "EECI-IGS various summer schools",
    "deadline": "",
    "city": "Zurich",
    "country": "Swiss",
    "link": "http://www.eeci-igsc.eu/",
    "type": "School",
    "shortName": "EECIIGS",
    "start": "2022-07-11",
    "end": "2022-07-15",
    "addressLink": "",
    "note": ""
  },
  {
    "name": "Deep Learning Summer School",
    "deadline": "",
    "city": "Las Palmas de Gran Canaria",
    "country": "Spain",
    "link": "https://irdta.eu/deeplearn/2022su/",
    "type": "School",
    "shortName": "DLSU",
    "start": "2022-07-25",
    "end": "2022-07-29",
    "addressLink": "",
    "note": ""
  },
  {
    "name": "IEEE RAS Summer School",
    "deadline": "",
    "city": "Praga",
    "country": "Czech",
    "link": "http://mrs.felk.cvut.cz/summer-school-2022/",
    "type": "School",
    "shortName": "RASSS",
    "start": "2022-09-01",
    "end": "2022-09-05",
    "addressLink": "",
    "note": ""
  },
  {
    "name": "Summer School on Service-Based and Cloud Robotics",
    "deadline": "",
    "city": "Palma de Majorca",
    "country": "Spain",
    "link": "",
    "type": "School",
    "shortName": "SBCR",
    "start": "2022-09-20",
    "end": "2022-09-22",
    "addressLink": "",
    "note": ""
  },
  {
    "name": "DeepLearn 2022 Autumn",
    "deadline": "",
    "city": "Luleå",
    "country": "Sweden",
    "link": "https://irdta.eu/deeplearn/2022au/",
    "type": "School",
    "shortName": "DLAU",
    "start": "2022-10-17",
    "end": "2022-10-21",
    "addressLink": "",
    "note": ""
  },
  {
    "name": "1ère Edition de l'Ecole du GT8 Apprentissage et Neurosciences pour la Robotique ",
    "deadline": "",
    "city": "Moliets et Maa (Landes)",
    "country": "France",
    "link": "https://sites.google.com/view/ecoledugt8/accueil",
    "type": "School",
    "shortName": "ANR",
    "start": "2022-10-20",
    "end": "2022-10-23",
    "addressLink": "",
    "note": ""
  },
  {
    "name": "Surgical Imaging and Vision WINTER SCHOOL",
    "deadline": "",
    "city": "London",
    "country": "UK",
    "link": "https://www.imperial.ac.uk/hamlyn-centre/names--global-engagement/hamlyn-winter-school-on-surgical-imaging-and-vision/",
    "type": "School",
    "shortName": "SIV",
    "start": "2022-12-05",
    "end": "2022-12-09",
    "addressLink": "",
    "note": ""
  }
]
